card_number,tier,rank,name,alignment,element,faction,hp,atk,rapid,charge,defense,move_1,move_2,move_3,move_4,move_5,move_6,move_7,move_8,move_9,flavor_text,construct_sprite,source_identities,color_palette
ZETA-2845,ZETA,7,Thar Guardian,Angelic,Wind,CELESTIAL ORDER,1855,153,36,32,120,Gale Empower,Gale Strike,Zephyr Rush,Breeze Terminus,Squall Bind,Breeze Slam,Draft Apotheosis,Squall Restore,Draft Drain,Thar Guardian descends from the LUMINA SECT. Wind radiance shields the faithful.,ZETA-2845_Thar_Guardian_idle.png,ID.2938|ID.3645|ID.7767,"[104, 172, 54]"
ZETA-2846,ZETA,7,Ravir,Demonic,Blood,BRIMSTONE CELL,2087,152,36,25,171,Pulse Onslaught,Crimson Onslaught,Hemorrhage Drain,Hemorrhage Zenith,Pulse Cleanse,Sanguine Drain,Vital Apotheosis,Vital Ward,Sanguine Onslaught,Ravir claws forth from the PANDEMONIUM NET. Blood burns in its wake.,ZETA-2846_Ravir_idle.png,ID.6873|ID.3491|ID.9570,"[190, 228, 141]"
ZETA-2847,ZETA,7,Thalion,Angelic,Fire,HALO CORE,1674,156,24,34,167,Blaze Charge,Combust Terminus,Inferno Barrage,Blaze Apotheosis,Combust Lock,Inferno Shield,Ignite Charge,Scorch Boost,Ignite Lock,Thalion descends from the CELESTIAL ORDER. Fire radiance shields the faithful.,ZETA-2847_Thalion_idle.png,ID.5195|ID.5117|ID.2623,"[78, 126, 150]"
ZETA-2848,ZETA,7,StellarVion,Mechanical,Lightning,SYNTHETIC NETWORK,1581,115,31,29,143,Thunder Shield,Spark Silence,Surge Charge,Arc Ward,Surge Barrage,Spark Cataclysm,Arc Apotheosis,Static Bind,Volt Slam,Unit StellarVion deployed from PROTOCOL DIVISION. Core temperature stable. Elemental sync: Lightning.,ZETA-2848_StellarVion_idle.png,ID.5675|ID.4127|ID.4307,"[100, 177, 154]"
ZETA-2849,ZETA,7,Wynnir,Mechanical,Water,PROTOCOL DIVISION,1721,176,32,38,186,Abyss Onslaught,Abyss Terminus,Abyss Drain,Current Onslaught,Depth Bind,Depth Ward,Tide Barrage,Torrent Shield,Current Overdrive,Unit Wynnir deployed from IRON CORTEX. Core temperature stable. Elemental sync: Water.,ZETA-2849_Wynnir_idle.png,ID.3559|ID.5844|ID.3835,"[193, 108, 24]"
ZETA-2850,ZETA,7,Thas Frame,Mechanical,Wind,GEAR SECT,2015,127,30,34,188,Draft Restore,Cyclone Apotheosis,Breeze Stun,Cyclone Barrage,Cyclone Charge,Draft Rush,Draft Silence,Gale Ward,Cyclone Overdrive,Unit Thas Frame deployed from SYNTHETIC NETWORK. Core temperature stable. Elemental sync: Wind.,ZETA-2850_Thas_Frame_idle.png,ID.3540|ID.6158|ID.8136,"[61, 91, 239]"
ZETA-2851,ZETA,7,Kaelrios,Demonic,Fire,BRIMSTONE CELL,1763,139,27,37,148,Ignite Zenith,Inferno Shield,Ignite Barrage,Scorch Cataclysm,Scorch Suppress,Ignite Rush,Inferno Ward,Ignite Lock,Blaze Strike,Kaelrios claws forth from the BRIMSTONE CELL. Fire burns in its wake.,ZETA-2851_Kaelrios_idle.png,ID.8243|ID.2473|ID.2883,"[95, 85, 237]"
ZETA-2852,ZETA,7,SolarVek,Mechanical,Fire,PROTOCOL DIVISION,2149,161,34,36,163,Ignite Bind,Scorch Charge,Combust Empower,Ignite Rush,Ignite Onslaught,Blaze Zenith,Ember Drain,Inferno Empower,Inferno Overdrive,Unit SolarVek deployed from SYNTHETIC NETWORK. Core temperature stable. Elemental sync: Fire.,ZETA-2852_SolarVek_idle.png,ID.4346|ID.2935|ID.4638,"[16, 179, 215]"
ZETA-2853,ZETA,7,Xis Frame,Mechanical,Nature,GEAR SECT,1896,157,27,34,186,Spore Onslaught,Root Apotheosis,Canopy Onslaught,Thorn Stun,Canopy Empower,Canopy Ward,Canopy Barrage,Bloom Cataclysm,Bloom Lock,Unit Xis Frame deployed from SYNTHETIC NETWORK. Core temperature stable. Elemental sync: Nature.,ZETA-2853_Xis_Frame_idle.png,ID.7330|ID.2592|ID.1778,"[146, 208, 86]"
ZETA-2854,ZETA,7,Lis Mutant,Viral,Water,ROT CLUSTER,2335,165,27,36,142,Depth Suppress,Depth Catalyst,Torrent Drain,Torrent Cleanse,Torrent Restore,Torrent Strike,Surge Strike,Depth Slam,Current Zenith,Strain Lis Mutant breaches containment. Water-mutation sequence active. Quarantine failed.,ZETA-2854_Lis_Mutant_idle.png,ID.4771|ID.2766|ID.1905,"[57, 14, 253]"
ZETA-2855,ZETA,7,QuantumMion,Angelic,Water,ASTRUM DIVISION,2039,142,35,38,142,Surge Onslaught,Surge Bind,Surge Empower,Tide Shield,Torrent Onslaught,Abyss Zenith,Surge Drain,Surge Slam,Tide Zenith,QuantumMion descends from the LUMINA SECT. Water radiance shields the faithful.,ZETA-2855_QuantumMion_idle.png,ID.8858|ID.3010|ID.2567,"[120, 146, 84]"
ZETA-2856,ZETA,7,Thos Protocol,Mechanical,Light,GEAR SECT,2192,165,29,25,133,Radiance Boost,Dawn Stun,Lumen Cataclysm,Lumen Charge,Radiance Onslaught,Lumen Boost,Lumen Lock,Lumen Zenith,Prism Charge,Unit Thos Protocol deployed from SYNTHETIC NETWORK. Core temperature stable. Elemental sync: Light.,ZETA-2856_Thos_Protocol_idle.png,ID.5303|ID.6026|ID.7045,"[11, 17, 138]"
ZETA-2857,ZETA,7,Solun,Angelic,Gravity,HALO CORE,2380,114,27,40,186,Crush Boost,Mass Restore,Anchor Bind,Pull Apotheosis,Weight Strike,Crush Suppress,Mass Barrage,Singularity Apotheosis,Anchor Strike,Solun descends from the LUMINA SECT. Gravity radiance shields the faithful.,ZETA-2857_Solun_idle.png,ID.4578|ID.9069|ID.7958,"[223, 189, 3]"
ZETA-2858,ZETA,7,PrimeVire,Mechanical,Earth,GEAR SECT,2316,123,34,36,154,Mountain Catalyst,Stone Stun,Core Strike,Core Restore,Quake Overdrive,Core Cleanse,Quake Onslaught,Mountain Stun,Stone Slam,Unit PrimeVire deployed from SYNTHETIC NETWORK. Core temperature stable. Elemental sync: Earth.,ZETA-2858_PrimeVire_idle.png,ID.4938|ID.1187|ID.9821,"[89, 60, 23]"
ZETA-2859,ZETA,7,Sylir,Viral,Ice,ROT CLUSTER,1805,174,33,28,178,Hail Zenith,Hail Cleanse,Glacier Strike,Chill Lock,Crystal Barrage,Crystal Ward,Frost Bind,Freeze Overdrive,Crystal Onslaught,Strain Sylir breaches containment. Ice-mutation sequence active. Quarantine failed.,ZETA-2859_Sylir_idle.png,ID.9233|ID.2862|ID.2976,"[44, 19, 138]"
ZETA-2860,ZETA,7,Omis,Angelic,Metal,HALO CORE,2260,110,30,40,132,Plate Catalyst,Plate Zenith,Forge Empower,Iron Stun,Iron Silence,Plate Onslaught,Steel Barrage,Titan Empower,Forge Rush,Omis descends from the CELESTIAL ORDER. Metal radiance shields the faithful.,ZETA-2860_Omis_idle.png,ID.1466|ID.6846|ID.5555,"[222, 90, 39]"
ZETA-2861,ZETA,7,Kros Drone,Mechanical,Dark,SYNTHETIC NETWORK,2006,192,29,29,155,Umbra Cataclysm,Void Drain,Abyss Bind,Umbra Onslaught,Night Charge,Night Terminus,Eclipse Onslaught,Void Ward,Eclipse Cleanse,Unit Kros Drone deployed from PROTOCOL DIVISION. Core temperature stable. Elemental sync: Dark.,ZETA-2861_Kros_Drone_idle.png,ID.4251|ID.1611|ID.7956,"[152, 42, 203]"
ZETA-2862,ZETA,7,Pher Drone,Mechanical,Plasma,SYNTHETIC NETWORK,1661,122,35,30,123,Ion Silence,Nebula Overdrive,Star Strike,Flux Suppress,Nebula Empower,Solar Catalyst,Star Strike,Fusion Barrage,Nebula Cleanse,Unit Pher Drone deployed from SYNTHETIC NETWORK. Core temperature stable. Elemental sync: Plasma.,ZETA-2862_Pher_Drone_idle.png,ID.1775|ID.4465|ID.3907,"[45, 16, 10]"
ZETA-2863,ZETA,7,Omos,Viral,Time,CORRUPTED SECTOR,1930,157,34,39,110,Era Bind,Era Ward,Shift Empower,Epoch Terminus,Paradox Catalyst,Epoch Slam,Chrono Drain,Era Slam,Shift Barrage,Strain Omos breaches containment. Time-mutation sequence active. Quarantine failed.,ZETA-2863_Omos_idle.png,ID.8856|ID.1680|ID.8610,"[182, 76, 101]"
ZETA-2864,ZETA,7,Kryun,Viral,Dark,CORRUPTED SECTOR,1478,183,29,25,184,Umbra Apotheosis,Shadow Rush,Shadow Silence,Umbra Lock,Void Zenith,Eclipse Slam,Eclipse Ward,Abyss Slam,Void Boost,Strain Kryun breaches containment. Dark-mutation sequence active. Quarantine failed.,ZETA-2864_Kryun_idle.png,ID.4484|ID.1857|ID.3735,"[20, 190, 247]"
ZETA-2865,ZETA,7,Sol Beast,Demonic,Wind,VOID CULT,2067,198,26,29,171,Zephyr Slam,Draft Charge,Cyclone Suppress,Squall Shield,Breeze Silence,Zephyr Terminus,Draft Cleanse,Breeze Apotheosis,Squall Rush,Sol Beast claws forth from the VOID CULT. Wind burns in its wake.,ZETA-2865_Sol_Beast_idle.png,ID.3608|ID.5833|ID.2017,"[161, 73, 104]"
ZETA-2866,ZETA,7,PhantomNax,Viral,Poison,INFECTION VECTOR,1925,134,32,37,161,Blight Catalyst,Plague Silence,Miasma Cataclysm,Blight Stun,Toxin Barrage,Miasma Charge,Plague Shield,Venom Restore,Contagion Slam,Strain PhantomNax breaches containment. Poison-mutation sequence active. Quarantine failed.,ZETA-2866_PhantomNax_idle.png,ID.9443|ID.4342|ID.8237,"[27, 234, 185]"
ZETA-2867,ZETA,7,Vex Host,Viral,Nature,PHAGE CELL,1722,178,33,29,131,Canopy Overdrive,Bloom Rush,Vine Catalyst,Canopy Stun,Bloom Empower,Root Charge,Root Onslaught,Vine Shield,Thorn Drain,Strain Vex Host breaches containment. Nature-mutation sequence active. Quarantine failed.,ZETA-2867_Vex_Host_idle.png,ID.1827|ID.3761|ID.8922,"[199, 115, 247]"
ZETA-2868,ZETA,7,Kryvire,Angelic,Lightning,LUMINA SECT,2059,118,29,31,176,Spark Lock,Thunder Overdrive,Thunder Stun,Static Boost,Static Catalyst,Arc Barrage,Surge Barrage,Static Restore,Surge Charge,Kryvire descends from the LUMINA SECT. Lightning radiance shields the faithful.,ZETA-2868_Kryvire_idle.png,ID.1819|ID.4374|ID.6499,"[134, 112, 236]"
ZETA-2869,ZETA,7,Phir Fiend,Demonic,Nature,BRIMSTONE CELL,1554,167,32,28,98,Thorn Slam,Vine Lock,Canopy Onslaught,Thorn Rush,Vine Cataclysm,Thorn Boost,Vine Lock,Spore Empower,Thorn Catalyst,Phir Fiend claws forth from the ABYSSAL CABAL. Nature burns in its wake.,ZETA-2869_Phir_Fiend_idle.png,ID.3223|ID.6309|ID.4452,"[245, 67, 2]"
ZETA-2870,ZETA,7,VoidDune,Viral,Void,ROT CLUSTER,1892,148,28,34,175,Abyss Terminus,Abyss Charge,Zero Bind,Erase Cataclysm,Collapse Strike,Erase Shield,Entropy Silence,Entropy Shield,Collapse Slam,Strain VoidDune breaches containment. Void-mutation sequence active. Quarantine failed.,ZETA-2870_VoidDune_idle.png,ID.4159|ID.2445|ID.8857,"[176, 16, 239]"
ZETA-2871,ZETA,7,PrismaticVion,Viral,Plasma,INFECTION VECTOR,1598,148,31,25,145,Flux Strike,Solar Apotheosis,Solar Slam,Solar Slam,Nebula Suppress,Ion Restore,Star Terminus,Nebula Stun,Flux Ward,Strain PrismaticVion breaches containment. Plasma-mutation sequence active. Quarantine failed.,ZETA-2871_PrismaticVion_idle.png,ID.4958|ID.9171|ID.3246,"[97, 179, 170]"
ZETA-2872,ZETA,7,Aervius,Angelic,Earth,LUMINA SECT,1926,152,22,33,186,Fissure Slam,Terra Restore,Terra Suppress,Fissure Onslaught,Terra Silence,Quake Zenith,Terra Apotheosis,Mountain Restore,Stone Barrage,Aervius descends from the HALO CORE. Earth radiance shields the faithful.,ZETA-2872_Aervius_idle.png,ID.5838|ID.5865|ID.7260,"[244, 244, 48]"
ZETA-2873,ZETA,7,Vorn Construct,Mechanical,Nature,SYNTHETIC NETWORK,2169,157,30,28,146,Spore Slam,Bloom Onslaught,Bloom Barrage,Spore Lock,Root Drain,Spore Empower,Vine Boost,Spore Terminus,Root Zenith,Unit Vorn Construct deployed from IRON CORTEX. Core temperature stable. Elemental sync: Nature.,ZETA-2873_Vorn_Construct_idle.png,ID.8351|ID.2978|ID.5625,"[166, 146, 95]"
ZETA-2874,ZETA,7,Tor Unit,Mechanical,Wind,PROTOCOL DIVISION,1814,176,33,37,142,Gale Charge,Cyclone Suppress,Draft Shield,Squall Barrage,Cyclone Shield,Gale Catalyst,Squall Terminus,Cyclone Charge,Draft Suppress,Unit Tor Unit deployed from SYNTHETIC NETWORK. Core temperature stable. Elemental sync: Wind.,ZETA-2874_Tor_Unit_idle.png,ID.2105|ID.9300|ID.3553,"[68, 52, 104]"
ZETA-2875,ZETA,7,Mir Terror,Demonic,Wind,ABYSSAL CABAL,2175,187,27,28,91,Breeze Charge,Gale Bind,Squall Silence,Cyclone Strike,Cyclone Restore,Zephyr Catalyst,Draft Apotheosis,Zephyr Shield,Draft Onslaught,Mir Terror claws forth from the BRIMSTONE CELL. Wind burns in its wake.,ZETA-2875_Mir_Terror_idle.png,ID.7855|ID.7334|ID.1984,"[239, 234, 187]"
ZETA-2876,ZETA,7,AetherLor,Viral,Earth,CORRUPTED SECTOR,1402,185,35,30,106,Terra Zenith,Core Silence,Core Cleanse,Mountain Cleanse,Terra Barrage,Quake Drain,Core Charge,Quake Onslaught,Fissure Terminus,Strain AetherLor breaches containment. Earth-mutation sequence active. Quarantine failed.,ZETA-2876_AetherLor_idle.png,ID.7183|ID.7864|ID.5589,"[14, 39, 112]"
ZETA-2877,ZETA,7,Solas,Demonic,Nature,VOID CULT,2170,192,35,31,145,Canopy Onslaught,Bloom Zenith,Canopy Slam,Spore Terminus,Vine Suppress,Vine Silence,Thorn Restore,Canopy Cleanse,Thorn Slam,Solas claws forth from the BRIMSTONE CELL. Nature burns in its wake.,ZETA-2877_Solas_idle.png,ID.3226|ID.5403|ID.2663,"[209, 8, 186]"
ZETA-2878,ZETA,7,Ophion,Angelic,Lightning,CELESTIAL ORDER,2308,122,22,36,175,Surge Slam,Arc Terminus,Static Suppress,Arc Overdrive,Thunder Boost,Spark Shield,Arc Lock,Static Onslaught,Volt Charge,Ophion descends from the HALO CORE. Lightning radiance shields the faithful.,ZETA-2878_Ophion_idle.png,ID.5421|ID.4952|ID.1185,"[240, 131, 2]"
ZETA-2879,ZETA,7,Ishas,Angelic,Void,CELESTIAL ORDER,1653,165,32,35,122,Zero Rush,Abyss Barrage,Erase Slam,Abyss Catalyst,Erase Cleanse,Abyss Suppress,Abyss Stun,Erase Restore,Abyss Catalyst,Ishas descends from the ASTRUM DIVISION. Void radiance shields the faithful.,ZETA-2879_Ishas_idle.png,ID.7271|ID.8313|ID.4790,"[13, 202, 240]"
ZETA-2880,ZETA,7,NeuralPhos,Mechanical,Dark,SYNTHETIC NETWORK,1970,137,29,28,172,Shadow Barrage,Umbra Rush,Shadow Cataclysm,Eclipse Shield,Shadow Empower,Eclipse Stun,Umbra Terminus,Abyss Charge,Void Stun,Unit NeuralPhos deployed from IRON CORTEX. Core temperature stable. Elemental sync: Dark.,ZETA-2880_NeuralPhos_idle.png,ID.1372|ID.8802|ID.8803,"[106, 172, 97]"
ZETA-2881,ZETA,7,Thos Cell,Viral,Blood,ROT CLUSTER,2353,184,29,27,127,Hemorrhage Terminus,Vital Strike,Crimson Terminus,Vein Boost,Crimson Ward,Sanguine Drain,Vein Charge,Vein Barrage,Hemorrhage Drain,Strain Thos Cell breaches containment. Blood-mutation sequence active. Quarantine failed.,ZETA-2881_Thos_Cell_idle.png,ID.8526|ID.6933|ID.3683,"[36, 22, 44]"
ZETA-2882,ZETA,7,Kalzane,Viral,Metal,PHAGE CELL,1943,181,36,25,171,Forge Rush,Steel Catalyst,Alloy Stun,Alloy Restore,Titan Overdrive,Alloy Slam,Titan Restore,Steel Slam,Steel Suppress,Strain Kalzane breaches containment. Metal-mutation sequence active. Quarantine failed.,ZETA-2882_Kalzane_idle.png,ID.3139|ID.2663|ID.3355,"[231, 23, 37]"
ZETA-2883,ZETA,7,Axien,Viral,Nature,ROT CLUSTER,1796,192,33,28,126,Canopy Boost,Spore Rush,Vine Shield,Spore Onslaught,Canopy Silence,Vine Catalyst,Root Lock,Canopy Rush,Canopy Catalyst,Strain Axien breaches containment. Nature-mutation sequence active. Quarantine failed.,ZETA-2883_Axien_idle.png,ID.4108|ID.1547|ID.7425,"[85, 89, 68]"
ZETA-2884,ZETA,7,Zane Strain,Viral,Ice,PHAGE CELL,1791,184,31,30,143,Chill Charge,Chill Terminus,Frost Cleanse,Freeze Drain,Crystal Strike,Crystal Cataclysm,Hail Shield,Chill Slam,Freeze Suppress,Strain Zane Strain breaches containment. Ice-mutation sequence active. Quarantine failed.,ZETA-2884_Zane_Strain_idle.png,ID.8937|ID.4611|ID.6658,"[186, 145, 250]"
ZETA-2885,ZETA,7,Mion Reaver,Demonic,Metal,BRIMSTONE CELL,2207,150,30,26,170,Forge Charge,Steel Overdrive,Titan Catalyst,Plate Silence,Alloy Empower,Alloy Barrage,Steel Stun,Alloy Restore,Titan Strike,Mion Reaver claws forth from the ABYSSAL CABAL. Metal burns in its wake.,ZETA-2885_Mion_Reaver_idle.png,ID.2186|ID.8450|ID.1433,"[36, 38, 144]"
ZETA-2886,ZETA,7,Omlor,Demonic,Plasma,BRIMSTONE CELL,2227,159,26,31,175,Fusion Charge,Solar Suppress,Nebula Cataclysm,Flux Strike,Ion Ward,Ion Suppress,Star Strike,Flux Restore,Solar Terminus,Omlor claws forth from the PANDEMONIUM NET. Plasma burns in its wake.,ZETA-2886_Omlor_idle.png,ID.6224|ID.9178|ID.4980,"[217, 44, 190]"
ZETA-2887,ZETA,7,Vax Beast,Demonic,Metal,VOID CULT,1597,168,28,29,129,Iron Onslaught,Alloy Boost,Plate Slam,Plate Boost,Titan Suppress,Alloy Cataclysm,Plate Barrage,Plate Apotheosis,Steel Drain,Vax Beast claws forth from the PANDEMONIUM NET. Metal burns in its wake.,ZETA-2887_Vax_Beast_idle.png,ID.8695|ID.3248|ID.3710,"[179, 179, 75]"
ZETA-2888,ZETA,7,Gorn Sentinel,Angelic,Metal,ASTRUM DIVISION,1755,181,28,31,132,Iron Empower,Iron Shield,Alloy Suppress,Alloy Terminus,Titan Charge,Plate Cataclysm,Steel Bind,Plate Rush,Forge Strike,Gorn Sentinel descends from the CELESTIAL ORDER. Metal radiance shields the faithful.,ZETA-2888_Gorn_Sentinel_idle.png,ID.3501|ID.2236|ID.6474,"[162, 189, 91]"
ZETA-2889,ZETA,7,Morn Vector,Viral,Blood,INFECTION VECTOR,1432,192,28,26,184,Pulse Ward,Sanguine Boost,Vein Overdrive,Vital Lock,Hemorrhage Overdrive,Vein Rush,Vital Silence,Vital Onslaught,Hemorrhage Barrage,Strain Morn Vector breaches containment. Blood-mutation sequence active. Quarantine failed.,ZETA-2889_Morn_Vector_idle.png,ID.7487|ID.9732|ID.2949,"[47, 2, 183]"
ZETA-2890,ZETA,7,SynapticZane,Viral,Metal,CORRUPTED SECTOR,1509,193,30,38,100,Alloy Zenith,Plate Empower,Forge Onslaught,Iron Boost,Steel Silence,Plate Charge,Steel Suppress,Alloy Charge,Steel Terminus,Strain SynapticZane breaches containment. Metal-mutation sequence active. Quarantine failed.,ZETA-2890_SynapticZane_idle.png,ID.4169|ID.1243|ID.7872,"[189, 13, 53]"
ZETA-2891,ZETA,7,SynapticNax,Angelic,Nature,LUMINA SECT,1925,150,31,38,115,Vine Lock,Thorn Rush,Spore Cataclysm,Vine Shield,Spore Restore,Vine Charge,Spore Apotheosis,Root Onslaught,Vine Silence,SynapticNax descends from the HALO CORE. Nature radiance shields the faithful.,ZETA-2891_SynapticNax_idle.png,ID.6357|ID.2969|ID.9846,"[51, 48, 34]"
ZETA-2892,ZETA,7,Myrir,Mechanical,Dark,SYNTHETIC NETWORK,1595,131,34,30,137,Eclipse Cleanse,Abyss Terminus,Eclipse Barrage,Eclipse Restore,Umbra Slam,Umbra Suppress,Night Suppress,Shadow Terminus,Night Slam,Unit Myrir deployed from GEAR SECT. Core temperature stable. Elemental sync: Dark.,ZETA-2892_Myrir_idle.png,ID.8436|ID.7888|ID.9373,"[55, 182, 204]"
ZETA-2893,ZETA,7,Xel Unit,Mechanical,Light,PROTOCOL DIVISION,2270,147,29,38,168,Beam Overdrive,Radiance Silence,Prism Restore,Radiance Onslaught,Lumen Overdrive,Radiance Rush,Radiance Slam,Dawn Drain,Dawn Boost,Unit Xel Unit deployed from SYNTHETIC NETWORK. Core temperature stable. Elemental sync: Light.,ZETA-2893_Xel_Unit_idle.png,ID.9682|ID.3269|ID.4025,"[94, 117, 9]"
ZETA-2894,ZETA,7,AetherPhos,Mechanical,Ice,PROTOCOL DIVISION,2316,191,35,33,189,Glacier Apotheosis,Chill Boost,Hail Overdrive,Frost Barrage,Freeze Drain,Freeze Lock,Frost Shield,Crystal Charge,Crystal Strike,Unit AetherPhos deployed from GEAR SECT. Core temperature stable. Elemental sync: Ice.,ZETA-2894_AetherPhos_idle.png,ID.1777|ID.8615|ID.3522,"[200, 122, 45]"
ZETA-2895,ZETA,7,Helis,Angelic,Crystal,ASTRUM DIVISION,2311,138,22,38,140,Shard Slam,Facet Boost,Geode Barrage,Facet Bind,Geode Boost,Geode Zenith,Facet Apotheosis,Geode Stun,Facet Charge,Helis descends from the ASTRUM DIVISION. Crystal radiance shields the faithful.,ZETA-2895_Helis_idle.png,ID.7510|ID.9702|ID.6799,"[35, 206, 112]"
ZETA-2896,ZETA,7,Syldune,Mechanical,Blood,PROTOCOL DIVISION,1537,121,26,25,143,Vein Apotheosis,Sanguine Shield,Vein Bind,Crimson Cleanse,Hemorrhage Apotheosis,Crimson Rush,Hemorrhage Drain,Vein Strike,Crimson Rush,Unit Syldune deployed from IRON CORTEX. Core temperature stable. Elemental sync: Blood.,ZETA-2896_Syldune_idle.png,ID.3929|ID.1309|ID.4484,"[76, 155, 105]"
ZETA-2897,ZETA,7,Toroth,Viral,Earth,INFECTION VECTOR,1752,162,26,33,177,Mountain Zenith,Mountain Slam,Core Charge,Core Charge,Stone Boost,Stone Restore,Fissure Terminus,Core Drain,Core Drain,Strain Toroth breaches containment. Earth-mutation sequence active. Quarantine failed.,ZETA-2897_Toroth_idle.png,ID.5755|ID.2584|ID.9109,"[226, 251, 103]"
ZETA-2898,ZETA,7,StellarMorn,Mechanical,Time,PROTOCOL DIVISION,2099,157,30,34,134,Loop Silence,Epoch Bind,Shift Cataclysm,Chrono Charge,Paradox Shield,Loop Barrage,Loop Overdrive,Paradox Charge,Chrono Restore,Unit StellarMorn deployed from SYNTHETIC NETWORK. Core temperature stable. Elemental sync: Time.,ZETA-2898_StellarMorn_idle.png,ID.8438|ID.8536|ID.7117,"[244, 13, 147]"
ZETA-2899,ZETA,7,Yoran,Demonic,Light,BRIMSTONE CELL,1523,182,29,34,145,Solar Empower,Dawn Overdrive,Beam Ward,Prism Catalyst,Prism Strike,Dawn Slam,Prism Silence,Beam Silence,Prism Rush,Yoran claws forth from the PANDEMONIUM NET. Light burns in its wake.,ZETA-2899_Yoran_idle.png,ID.4413|ID.7045|ID.6210,"[10, 172, 185]"
ZETA-2900,ZETA,7,Fenvex,Viral,Earth,CORRUPTED SECTOR,2116,182,33,29,90,Terra Charge,Mountain Suppress,Stone Stun,Terra Empower,Mountain Empower,Mountain Barrage,Fissure Overdrive,Core Cataclysm,Fissure Strike,Strain Fenvex breaches containment. Earth-mutation sequence active. Quarantine failed.,ZETA-2900_Fenvex_idle.png,ID.1100|ID.6007|ID.1305,"[11, 60, 175]"
ZETA-2901,ZETA,7,CelestialDune,Viral,Plasma,INFECTION VECTOR,2374,141,27,31,164,Solar Strike,Solar Suppress,Solar Barrage,Flux Bind,Solar Terminus,Fusion Ward,Flux Cleanse,Flux Terminus,Fusion Rush,Strain CelestialDune breaches containment. Plasma-mutation sequence active. Quarantine failed.,ZETA-2901_CelestialDune_idle.png,ID.6674|ID.4025|ID.6072,"[35, 140, 181]"
ZETA-2902,ZETA,7,Zire Drone,Mechanical,Poison,SYNTHETIC NETWORK,1938,174,32,38,122,Blight Lock,Toxin Shield,Toxin Onslaught,Plague Zenith,Toxin Charge,Plague Cleanse,Plague Bind,Blight Apotheosis,Contagion Onslaught,Unit Zire Drone deployed from IRON CORTEX. Core temperature stable. Elemental sync: Poison.,ZETA-2902_Zire_Drone_idle.png,ID.7676|ID.4348|ID.5131,"[174, 84, 78]"
ZETA-2903,ZETA,7,AstralMion,Angelic,Wind,ASTRUM DIVISION,1896,196,24,39,153,Breeze Ward,Cyclone Lock,Gale Charge,Cyclone Bind,Zephyr Catalyst,Cyclone Shield,Squall Terminus,Draft Slam,Cyclone Strike,AstralMion descends from the ASTRUM DIVISION. Wind radiance shields the faithful.,ZETA-2903_AstralMion_idle.png,ID.3159|ID.7290|ID.5851,"[83, 115, 37]"
ZETA-2904,ZETA,7,Ophus,Angelic,Dark,CELESTIAL ORDER,2379,114,34,36,120,Shadow Apotheosis,Eclipse Silence,Shadow Terminus,Void Slam,Eclipse Strike,Shadow Slam,Abyss Stun,Umbra Ward,Abyss Cleanse,Ophus descends from the LUMINA SECT. Dark radiance shields the faithful.,ZETA-2904_Ophus_idle.png,ID.7071|ID.6680|ID.2976,"[181, 175, 198]"
ZETA-2905,ZETA,7,Zepiel,Angelic,Nature,CELESTIAL ORDER,1791,131,30,33,141,Vine Boost,Root Terminus,Canopy Charge,Spore Stun,Root Cleanse,Root Barrage,Bloom Drain,Thorn Cataclysm,Root Barrage,Zepiel descends from the CELESTIAL ORDER. Nature radiance shields the faithful.,ZETA-2905_Zepiel_idle.png,ID.4506|ID.6000|ID.3497,"[59, 53, 125]"
ZETA-2906,ZETA,7,Xenael,Demonic,Poison,ABYSSAL CABAL,1967,194,33,27,168,Venom Slam,Contagion Apotheosis,Toxin Rush,Plague Barrage,Miasma Restore,Venom Silence,Blight Restore,Venom Cataclysm,Venom Suppress,Xenael claws forth from the BRIMSTONE CELL. Poison burns in its wake.,ZETA-2906_Xenael_idle.png,ID.3726|ID.9067|ID.6898,"[181, 109, 160]"
ZETA-2907,ZETA,7,Solgorn,Demonic,Dark,ABYSSAL CABAL,1488,154,29,39,151,Shadow Catalyst,Umbra Restore,Umbra Suppress,Umbra Charge,Eclipse Drain,Umbra Catalyst,Void Cleanse,Umbra Slam,Abyss Rush,Solgorn claws forth from the PANDEMONIUM NET. Dark burns in its wake.,ZETA-2907_Solgorn_idle.png,ID.4776|ID.2940|ID.7104,"[88, 49, 155]"
ZETA-2908,ZETA,7,Lor Reaver,Demonic,Fire,PANDEMONIUM NET,1546,191,29,33,176,Inferno Cleanse,Ignite Apotheosis,Ignite Strike,Ignite Bind,Inferno Silence,Ember Barrage,Scorch Apotheosis,Ember Rush,Scorch Restore,Lor Reaver claws forth from the ABYSSAL CABAL. Fire burns in its wake.,ZETA-2908_Lor_Reaver_idle.png,ID.4021|ID.2724|ID.4059,"[0, 101, 56]"
ZETA-2909,ZETA,7,VoidVorn,Viral,Poison,PHAGE CELL,2112,197,28,27,105,Contagion Rush,Toxin Restore,Plague Bind,Toxin Terminus,Plague Barrage,Venom Zenith,Toxin Barrage,Venom Restore,Contagion Bind,Strain VoidVorn breaches containment. Poison-mutation sequence active. Quarantine failed.,ZETA-2909_VoidVorn_idle.png,ID.5906|ID.1145|ID.8266,"[159, 72, 193]"
ZETA-2910,ZETA,7,Nir Horror,Demonic,Wind,VOID CULT,1791,196,33,25,108,Gale Stun,Squall Empower,Draft Catalyst,Draft Barrage,Squall Suppress,Draft Slam,Draft Catalyst,Breeze Barrage,Draft Shield,Nir Horror claws forth from the VOID CULT. Wind burns in its wake.,ZETA-2910_Nir_Horror_idle.png,ID.3102|ID.7346|ID.4671,"[135, 29, 52]"
ZETA-2911,ZETA,7,Pyrvius,Mechanical,Blood,PROTOCOL DIVISION,1619,171,33,36,165,Sanguine Cataclysm,Vital Charge,Vein Barrage,Crimson Bind,Hemorrhage Boost,Vital Shield,Hemorrhage Suppress,Vein Onslaught,Sanguine Zenith,Unit Pyrvius deployed from SYNTHETIC NETWORK. Core temperature stable. Elemental sync: Blood.,ZETA-2911_Pyrvius_idle.png,ID.1060|ID.7122|ID.1508,"[183, 99, 16]"
ZETA-2912,ZETA,7,AstralDra,Angelic,Crystal,ASTRUM DIVISION,2395,124,34,31,120,Geode Boost,Prism Slam,Prism Overdrive,Geode Bind,Shard Restore,Facet Barrage,Shard Charge,Lattice Stun,Geode Apotheosis,AstralDra descends from the HALO CORE. Crystal radiance shields the faithful.,ZETA-2912_AstralDra_idle.png,ID.2024|ID.2362|ID.6277,"[65, 152, 204]"
ZETA-2913,ZETA,7,LunarNir,Demonic,Dark,ABYSSAL CABAL,1937,153,35,29,146,Umbra Silence,Shadow Charge,Abyss Strike,Abyss Cleanse,Night Restore,Shadow Cataclysm,Eclipse Charge,Umbra Silence,Night Overdrive,LunarNir claws forth from the ABYSSAL CABAL. Dark burns in its wake.,ZETA-2913_LunarNir_idle.png,ID.3558|ID.6802|ID.9416,"[25, 76, 238]"
ZETA-2914,ZETA,7,Krylis,Angelic,Void,HALO CORE,1901,151,34,29,128,Entropy Shield,Entropy Suppress,Erase Overdrive,Null Barrage,Erase Suppress,Entropy Onslaught,Entropy Apotheosis,Null Shield,Collapse Onslaught,Krylis descends from the HALO CORE. Void radiance shields the faithful.,ZETA-2914_Krylis_idle.png,ID.8513|ID.5253|ID.5987,"[187, 97, 102]"
ZETA-2915,ZETA,7,Lor Host,Viral,Dark,CORRUPTED SECTOR,2294,148,36,36,92,Eclipse Onslaught,Void Suppress,Abyss Slam,Night Lock,Abyss Boost,Void Apotheosis,Void Cleanse,Night Slam,Void Apotheosis,Strain Lor Host breaches containment. Dark-mutation sequence active. Quarantine failed.,ZETA-2915_Lor_Host_idle.png,ID.6465|ID.7640|ID.9348,"[77, 26, 222]"
ZETA-2916,ZETA,7,Qorkros,Angelic,Blood,LUMINA SECT,2388,152,35,32,171,Sanguine Bind,Sanguine Empower,Crimson Charge,Crimson Apotheosis,Sanguine Suppress,Vital Apotheosis,Crimson Charge,Sanguine Rush,Vital Restore,Qorkros descends from the HALO CORE. Blood radiance shields the faithful.,ZETA-2916_Qorkros_idle.png,ID.6949|ID.5607|ID.6925,"[158, 28, 228]"
ZETA-2917,ZETA,7,Vax Archon,Angelic,Earth,CELESTIAL ORDER,1670,157,32,34,131,Fissure Drain,Fissure Cleanse,Quake Restore,Core Barrage,Stone Cataclysm,Core Strike,Fissure Bind,Core Charge,Quake Apotheosis,Vax Archon descends from the ASTRUM DIVISION. Earth radiance shields the faithful.,ZETA-2917_Vax_Archon_idle.png,ID.5897|ID.6603|ID.4620,"[132, 224, 98]"
